[{"approved_security_identifiers":["TWSE:1102"],"approved_security_types":["equity"],"authorization_hash":"9ea1fb3b07cf686afb45abe566ec3f160404ef26cea75d7343896b8f62c3642f","authorization_id":"umea-v1-9ea1fb3b07cf686afb45","batch_group_id":"umeop-batch-v1-41c2cd4a5d80c21aaaf8","capability_id":"index_futures_context","consumption_binding_hash":"6dc7ef8b1196ad89429b9147608a732131011e5b66edcc16329cb69300544cc8","consumption_binding_id":"umeacb-v1-6dc7ef8b1196ad89429b","currentness_requirement":"eod_reference_only","execution_request_hash":"13055a7ca5d4121dfb50a5c21fa9f3f7ccf029cad4e9541dbe88db116a7e68aa","execution_request_id":"umereq-v2-13055a7ca5d4121dfb50","executor_id":"phase_i_i2_index_futures_context_executor","market":"TWSE","maximum_records":1,"network_authorized":true,"operation_id":"umeop-op-v1-c1b627ba23a0d7052d23","parameters":{},"plan_hash":"487a7af18d3b643a1e29f14abff5debe9a2d6ff793354d97e86359bcbbe4faa7","plan_id":"umeop-v1-487a7af18d3b643a1e29","relative_contained_output_path":"operations/umeop-op-v1-c1b627ba23a0d7052d23.execution-request.json","requested_fields":[],"schema_version":"unified_market_evidence_execution_request.v2","timeout_seconds":30},{"approved_security_identifiers":["TWSE:1101"],"approved_security_types":["equity"],"authorization_hash":"9ea1fb3b07cf686afb45abe566ec3f160404ef26cea75d7343896b8f62c3642f","authorization_id":"umea-v1-9ea1fb3b07cf686afb45","batch_group_id":"umeop-batch-v1-41c2cd4a5d80c21aaaf8","capability_id":"index_futures_context","consumption_binding_hash":"6dc7ef8b1196ad89429b9147608a732131011e5b66edcc16329cb69300544cc8","consumption_binding_id":"umeacb-v1-6dc7ef8b1196ad89429b","currentness_requirement":"eod_reference_only","execution_request_hash":"786b9dcd4c152aa143d9062954ed53b603e350b2fb6d7ac5f2c2ada75f2b1c8b","execution_request_id":"umereq-v2-786b9dcd4c152aa143d9","executor_id":"phase_i_i2_index_futures_context_executor","market":"TWSE","maximum_records":1,"network_authorized":true,"operation_id":"umeop-op-v1-e706a162b4b2d93d586c","parameters":{},"plan_hash":"487a7af18d3b643a1e29f14abff5debe9a2d6ff793354d97e86359bcbbe4faa7","plan_id":"umeop-v1-487a7af18d3b643a1e29","relative_contained_output_path":"operations/umeop-op-v1-e706a162b4b2d93d586c.execution-request.json","requested_fields":[],"schema_version":"unified_market_evidence_execution_request.v2","timeout_seconds":30}]